{
  "$schema": "https://json-schema.org/draft/2020-12/schema",
  "$id": "odd_world_model.context_projection.schema.json",
  "title": "ContextProjection",
  "type": "object",
  "additionalProperties": false,
  "required": ["schema_kind", "schema_version", "projection_ref", "context_basis", "projection_contract_ref", "renderer_ref", "representation_kind", "content", "content_digest", "included_refs", "omitted_refs", "exclusions", "fidelity", "losses", "truncation", "unresolved_gaps", "created_at", "projection_digest"],
  "properties": {
    "schema_kind": { "const": "odd_world_model.context_projection" },
    "schema_version": { "const": "v1" },
    "projection_ref": { "type": "string", "minLength": 1 },
    "context_basis": { "$ref": "odd_world_model.exact_ref.schema.json" },
    "projection_contract_ref": { "type": "string", "minLength": 1 },
    "renderer_ref": { "type": "string", "minLength": 1 },
    "representation_kind": { "const": "canonical_json" },
    "content": { "type": "string", "minLength": 1 },
    "content_digest": { "type": "string", "pattern": "^sha256:[0-9a-f]{64}$" },
    "included_refs": { "$ref": "#/$defs/exact_refs" },
    "omitted_refs": { "type": "array", "items": { "$ref": "#/$defs/omission" } },
    "exclusions": { "type": "array", "items": { "$ref": "#/$defs/omission" } },
    "fidelity": { "enum": ["lossless_projection", "lossy_projection"] },
    "losses": { "$ref": "#/$defs/strings" },
    "truncation": { "$ref": "#/$defs/truncation" },
    "unresolved_gaps": { "type": "array", "items": { "$ref": "odd_world_model.typed_gap.schema.json" } },
    "created_at": { "type": "string", "format": "date-time" },
    "projection_digest": { "type": "string", "pattern": "^sha256:[0-9a-f]{64}$" }
  },
  "allOf": [
    {
      "if": { "properties": { "fidelity": { "type": "string", "const": "lossless_projection" } }, "required": ["fidelity"] },
      "then": {
        "properties": {
          "losses": { "type": "array", "maxItems": 0 },
          "exclusions": { "type": "array", "maxItems": 0 },
          "unresolved_gaps": { "type": "array", "maxItems": 0 },
          "truncation": { "type": "object", "properties": { "applied": { "type": "boolean", "const": false }, "omitted_count": { "type": "integer", "const": 0 } } }
        }
      }
    },
    {
      "if": { "properties": { "fidelity": { "type": "string", "const": "lossy_projection" } }, "required": ["fidelity"] },
      "then": {
        "anyOf": [
          { "properties": { "losses": { "type": "array", "minItems": 1 } } },
          { "properties": { "exclusions": { "type": "array", "minItems": 1 } } },
          { "properties": { "unresolved_gaps": { "type": "array", "minItems": 1 } } },
          { "properties": { "truncation": { "type": "object", "properties": { "applied": { "type": "boolean", "const": true } }, "required": ["applied"] } } }
        ]
      }
    },
    {
      "if": {
        "properties": { "truncation": { "type": "object", "properties": { "applied": { "type": "boolean", "const": true } }, "required": ["applied"] } }
      },
      "then": {
        "properties": {
          "fidelity": { "type": "string", "const": "lossy_projection" },
          "losses": { "type": "array", "contains": { "type": "string", "const": "context_window_truncation" } }
        }
      }
    }
  ],
  "$defs": {
    "exact_refs": { "type": "array", "uniqueItems": true, "items": { "$ref": "odd_world_model.exact_ref.schema.json" } },
    "strings": { "type": "array", "uniqueItems": true, "items": { "type": "string", "minLength": 1 } },
    "omission": { "type": "object", "additionalProperties": false, "required": ["exact_ref", "reason"], "properties": { "exact_ref": { "$ref": "odd_world_model.exact_ref.schema.json" }, "reason": { "type": "string", "minLength": 1 } } },
    "truncation": {
      "type": "object",
      "additionalProperties": false,
      "required": ["applied", "limit_ref", "omitted_count"],
      "properties": {
        "applied": { "type": "boolean" },
        "limit_ref": { "type": "string", "minLength": 1 },
        "omitted_count": { "type": "integer", "minimum": 0 }
      },
      "allOf": [
        {
          "if": { "properties": { "applied": { "type": "boolean", "const": true } }, "required": ["applied"] },
          "then": { "properties": { "omitted_count": { "type": "integer", "minimum": 1 } } },
          "else": { "properties": { "omitted_count": { "type": "integer", "const": 0 } } }
        }
      ]
    }
  }
}
