{
  "schema_kind": "odd_world_model.context_projection",
  "schema_version": "v1",
  "projection_ref": "context-projection://odd_world_model/sandbox/trade_representation_model/v1",
  "context_basis": {
    "ref": "context-basis://odd_world_model/sandbox/trade_representation_model/v1",
    "digest": "sha256:ed0315766ca0a9a540121cbd18e8464b4c952561eef59a7bc6c3e1ed0a24be23"
  },
  "projection_contract_ref": "projection-contract://odd_world_model/sandbox/canonical-semantic-cut/v1",
  "renderer_ref": "renderer://odd_world_model/context-projection/canonical-json/v1",
  "representation_kind": "canonical_json",
  "content": "{\"basis_dependencies\":{\"mesh_cut\":{\"digest\":\"sha256:6287c83bcfa9caedf46ced33b4271a90b7aee92752fb248d9edb9e7a8a3f53cb\",\"ref\":\"mesh-cut://odd_world_model/sandbox/trade_representation_model/v1\"},\"physical_snapshot_refs\":[{\"digest\":\"sha256:8f4d8dc84957cee4291c0feee64fb59367dcd63d4d7f11f470a69ae0357a69bb\",\"ref\":\"iceberg-snapshot://wm.semantic_publications/7124086183510039804\",\"version\":\"file:///Users/jim/src/apps/odd_world_model/examples/trade_representation_model/sandbox/20260712T142827Z_0.0.0-development.f94aa30.dirty.cc665fcae1.TS/physical/runtime/warehouse/wm/semantic_publications/metadata/00001-71b41b83-4a27-42dc-8597-03f73e9401e8.metadata.json\"}],\"projection_contract_ref\":\"projection-contract://odd_world_model/sandbox/canonical-semantic-cut/v1\",\"projection_contract_version\":\"v1\",\"semantic_authority_refs\":[\"authority://odd_world_model/trade-representation-example/v1\",\"admission-witness://odd_world_model/sandbox/trade_representation_model-publication-v1\"],\"source_authority_refs\":[\"authority://odd_world_model/trade-representation-example/v1\"],\"source_observation_refs\":[{\"digest\":\"sha256:2cb7316fd3a6582d746e6cb5899d69d8543ef3e17b981a04f3b7520e2d63230f\",\"ref\":\"source-observation://odd_world_model/sandbox/trade_representation_model/v1\"}],\"temporal_coordinates\":{\"context_as_of\":\"2026-07-12T14:28:27.645Z\",\"source_observed_at\":\"2026-07-12T14:28:27.645Z\"}},\"context_basis\":{\"digest\":\"sha256:ed0315766ca0a9a540121cbd18e8464b4c952561eef59a7bc6c3e1ed0a24be23\",\"ref\":\"context-basis://odd_world_model/sandbox/trade_representation_model/v1\"},\"exclusions\":[],\"fidelity\":\"lossy_projection\",\"interaction_goal\":\"inspect the trade_representation_model world-model instance built by 0.0.0-development.f94aa30.dirty.cc665fcae1\",\"items\":[{\"content\":{\"candidate_markov_objects\":[{\"authority_ref\":\"authority://odd_world_model/trade-representation-example/v1\",\"boundary\":{\"excluded_refs\":[\"source-evidence://trade_representation_model/authority-notes\"],\"included_refs\":[\"source-field://trade_representation_model/trade_sandbox_001/agreement_id\",\"source-field://trade_representation_model/trade_sandbox_001/commodity_family\",\"source-field://trade_representation_model/trade_sandbox_001/commodity_name\",\"source-field://trade_representation_model/trade_sandbox_001/counterparty_id\",\"source-field://trade_representation_model/trade_sandbox_001/lifecycle_state\",\"source-field://trade_representation_model/trade_sandbox_001/product_name\",\"source-field://trade_representation_model/trade_sandbox_001/trade_id\"],\"rationale\":\"the retained trade_representation_model descriptor selects the explicit trade_representation fields and declares unprocessed source evidence as loss\"},\"candidate_basis\":{\"digest\":\"sha256:96c484c65f07493ce3cf68def8a0373d284be91d74205e219b2f1f275c4dfce3\",\"ref\":\"candidate-basis://odd_world_model/trade_representation_model/trade_sandbox_001/v1\"},\"created_at\":\"2026-07-12T14:28:27.645Z\",\"cut_digest\":\"sha256:e05889d7efc4dd31900d4ed0a141fcdb3a9a598f1abc064411e8eb48311556b4\",\"distributed_ledger_evidence_refs\":[\"ledger-entry:source-field://trade_representation_model/trade_sandbox_001/agreement_id\",\"ledger-entry:source-field://trade_representation_model/trade_sandbox_001/commodity_family\",\"ledger-entry:source-field://trade_representation_model/trade_sandbox_001/commodity_name\",\"ledger-entry:source-field://trade_representation_model/trade_sandbox_001/counterparty_id\",\"ledger-entry:source-field://trade_representation_model/trade_sandbox_001/lifecycle_state\",\"ledger-entry:source-field://trade_representation_model/trade_sandbox_001/product_name\",\"ledger-entry:source-field://trade_representation_model/trade_sandbox_001/trade_id\"],\"held_out_treatment_verification\":{\"corpus_ref\":\"source-inventory://odd_world_model/trade_representation_model/v1\",\"evidence_refs\":[\"source-corpus://odd_world_model/trade_representation_model/v1\",\"trade_sandbox_001\"],\"result\":\"inconclusive\",\"treatment_ref\":\"treatment://odd_world_model/trade_representation_model/trade_representation/v1\"},\"identity_direction\":{\"projection_ref\":\"projection://odd_world_model/trade_representation_model/trade_representation/v1\",\"source_state_refs\":[\"source-state://trade_representation_model/trade_sandbox_001/observed\"],\"target_state_refs\":[\"world-object://trade_representation_model/trade_sandbox_001/candidate\"]},\"null_peer_basis\":{\"digest\":\"sha256:9d583f5be6b62eab6df5c85d700ef00f7ae98db5da9ecf4581c0cdd7cc005be3\",\"ref\":\"null-peer-basis://odd_world_model/trade_representation_model/trade_sandbox_001/v1\"},\"object_identity\":\"trade_sandbox_001\",\"object_ref\":\"markov-object://odd_world_model/trade_representation_model/trade_sandbox_001/v1\",\"projection_support_refs\":[\"source-field://trade_representation_model/trade_sandbox_001/agreement_id\",\"source-field://trade_representation_model/trade_sandbox_001/commodity_family\",\"source-field://trade_representation_model/trade_sandbox_001/commodity_name\",\"source-field://trade_representation_model/trade_sandbox_001/counterparty_id\",\"source-field://trade_representation_model/trade_sandbox_001/lifecycle_state\",\"source-field://trade_representation_model/trade_sandbox_001/product_name\",\"source-field://trade_representation_model/trade_sandbox_001/trade_id\"],\"publication_classification\":\"candidate\",\"schema_kind\":\"odd_world_model.candidate_markov_object_cut\",\"schema_version\":\"v1\",\"source_observation\":{\"digest\":\"sha256:2cb7316fd3a6582d746e6cb5899d69d8543ef3e17b981a04f3b7520e2d63230f\",\"ref\":\"source-observation://odd_world_model/sandbox/trade_representation_model/v1\"}}],\"domain_payload\":{\"domain_input\":{\"bounded_context\":\"sandbox.trade_representation.capture\",\"evidence_refs\":[\"input://examples/trade_representation_model/sources/data/domain_input.json\",\"input://examples/trade_representation_model/sources/data/schema_snapshot.json\",\"input://examples/trade_representation_model/sources/uri_ledger/source_authority.md\",\"input://examples/trade_representation_model/sources/uri_ledger/source_notes.md\"],\"published_by\":\"team.sandbox.trade\",\"source_id\":\"sandbox.trade_representation\",\"summary\":\"Sandbox trade representation input for the first odd_world_model MVP lane.\",\"trade\":{\"agreement_id\":\"agreement_sandbox_001\",\"commodity_family\":\"energy\",\"commodity_name\":\"Brent crude\",\"counterparty_id\":\"counterparty_sandbox_001\",\"lifecycle_state\":\"booked\",\"product_name\":\"Brent commodity swap\",\"trade_id\":\"trade_sandbox_001\"}},\"example_name\":\"trade_representation_model\",\"schema_kind\":\"odd_world_model.example_domain_payload\",\"schema_snapshot\":{\"fields\":[\"trade_id\",\"product_name\",\"commodity_family\",\"commodity_name\",\"counterparty_id\",\"agreement_id\",\"booking_timestamp\",\"lifecycle_state\"],\"schema_name\":\"trade_capture_schema\"},\"schema_version\":\"v1\"},\"example_name\":\"trade_representation_model\",\"schema_kind\":\"odd_world_model.example_semantic_payload\",\"schema_version\":\"v1\",\"source_inventory\":{\"digest\":\"sha256:8f06596edb4d1fc71c6f1f828be1ae97147ba27a1775cdfc850d5ae1aba7f99e\",\"ref\":\"source-inventory://odd_world_model/trade_representation_model/v1\"}},\"exact_ref\":{\"digest\":\"sha256:1f5154e9b0b572e1a0d05b1c02460ae8a85511522584182d29c227118ef9d466\",\"ref\":\"semantic-cut://odd_world_model/sandbox/trade_representation_model/v1\",\"version\":\"v1\"}}],\"losses\":[\"authority notes are inventoried but not semantically interpreted by the deterministic example adapter\"],\"omitted_refs\":[],\"schema_kind\":\"odd_world_model.rendered_context_content\",\"schema_version\":\"v1\",\"truncation\":{\"applied\":false,\"limit_ref\":\"context-window://odd_world_model/sandbox/32-items\",\"omitted_count\":0},\"unresolved_gaps\":[]}",
  "content_digest": "sha256:bb30eb886df3d7a58f2808f298e54165f0a7f854377df10c65b485da6aa9a53b",
  "included_refs": [
    {
      "ref": "semantic-cut://odd_world_model/sandbox/trade_representation_model/v1",
      "digest": "sha256:1f5154e9b0b572e1a0d05b1c02460ae8a85511522584182d29c227118ef9d466",
      "version": "v1"
    }
  ],
  "omitted_refs": [],
  "exclusions": [],
  "fidelity": "lossy_projection",
  "losses": [
    "authority notes are inventoried but not semantically interpreted by the deterministic example adapter"
  ],
  "truncation": {
    "applied": false,
    "limit_ref": "context-window://odd_world_model/sandbox/32-items",
    "omitted_count": 0
  },
  "unresolved_gaps": [],
  "created_at": "2026-07-12T14:28:27.645Z",
  "projection_digest": "sha256:aa735eba2a4fbfdb9d3941ed945bb3487fe6361158aaf7cee5043afad96d692e"
}
